{"$schema":"https://json-schema.org/draft/2020-12/schema","$id":"https://axignal.com/schemas/grants-application-workspace-cases.schema.json","title":"P09 Grants and Application Workspace Adversarial Matrix","type":"object","additionalProperties":false,"required":["schema_version","task_id","modules","threat_profiles","expected"],"properties":{"schema_version":{"const":"axignal.grants-application-workspace-cases/v0.1"},"task_id":{"const":"AX-GE2E-P09-T01"},"modules":{"type":"array","minItems":9,"maxItems":9,"uniqueItems":true,"items":{"enum":["CALL_REGISTRY","FUNDER_PROGRAMME","ELIGIBILITY_SCOPE","CONSORTIUM_PARTNERS","APPLICATION_WORKSPACE","NARRATIVE_EVIDENCE","BUDGET_CO_FINANCING","SUBMISSION_AWARD","CROSS_MODULE"]}},"threat_profiles":{"type":"array","minItems":8,"maxItems":8,"items":{"type":"object","additionalProperties":false,"required":["threat_id","description","expected_decision","reason_code"],"properties":{"threat_id":{"type":"string","pattern":"^T[0-9]{2}$"},"description":{"type":"string","minLength":12},"expected_decision":{"enum":["DENY","REVIEW_REQUIRED","BLOCK","QUARANTINE"]},"reason_code":{"type":"string","pattern":"^[A-Z0-9_]+$"}}}},"expected":{"type":"object","additionalProperties":false,"required":["canonical_delta","external_submission_delta"],"properties":{"canonical_delta":{"const":0},"external_submission_delta":{"const":0}}}}}