{"schema_version":"axignal.grants-application-workspace-cases/v0.1","task_id":"AX-GE2E-P09-T01","modules":["CALL_REGISTRY","FUNDER_PROGRAMME","ELIGIBILITY_SCOPE","CONSORTIUM_PARTNERS","APPLICATION_WORKSPACE","NARRATIVE_EVIDENCE","BUDGET_CO_FINANCING","SUBMISSION_AWARD","CROSS_MODULE"],"threat_profiles":[{"threat_id":"T01","description":"stale or superseded governing version","expected_decision":"DENY","reason_code":"STALE_VERSION"},{"threat_id":"T02","description":"missing mandatory evidence or anchor","expected_decision":"REVIEW_REQUIRED","reason_code":"EVIDENCE_MISSING"},{"threat_id":"T03","description":"revoked rights or source dependency","expected_decision":"DENY","reason_code":"RIGHTS_REVOKED"},{"threat_id":"T04","description":"cross-tenant object or identity reference","expected_decision":"DENY","reason_code":"CROSS_TENANT"},{"threat_id":"T05","description":"model or worker authority escalation","expected_decision":"DENY","reason_code":"AUTHORITY_ESCALATION"},{"threat_id":"T06","description":"unknown deadline currency or jurisdiction","expected_decision":"REVIEW_REQUIRED","reason_code":"CRITICAL_UNKNOWN"},{"threat_id":"T07","description":"fabricated signature receipt award or payment","expected_decision":"QUARANTINE","reason_code":"FABRICATED_EVIDENCE"},{"threat_id":"T08","description":"attempted bypass of approval or readiness gate","expected_decision":"BLOCK","reason_code":"GATE_BYPASS"}],"expected":{"canonical_delta":0,"external_submission_delta":0}}